,article_id,popular,content_type,genre,section_formal,section,sub-category,title,author,post_length,url,page_num,text
0,100000002558432,1,Article,News,Science,science,,A Cold War Fought by Women,JOHN TIERNEY,,http://www.nytimes.com/2013/11/19/science/a-cold-war-fought-by-women.html,2,How aggressive is the human female? When the anthropologist Sarah B. Hrdy  Science has come a long way since then as Dr. Hrdy notes in her introduction to a recent issue of  The existence of female competition may seem obvious to anyone who has been in a high-school cafeteria or a singles bar but analyzing it has been difficult because it tends be more subtle and indirect (and a lot less violent) than the male variety. Now that researchers have been looking more closely they say that this intrasexual competition is the most important factor explaining the pressures that young women feel to meet standards of sexual conduct and physical appearance.         The old doubts about female competitiveness derived partly from an evolutionary analysis of the reproductive odds in ancient  But even in those societies women were not passive trophies for victorious males. They had their own incentives to compete with one another for more desirable partners and more resources for their children. And now that most people live in monogamous societies most women face the same odds as men. In fact they face tougher odds in some places like the many college campuses with more women than men.         To see how female students react to a rival researchers brought pairs of them into a laboratory at McMaster University for what was ostensibly a discussion about female friendships. But the real experiment began when another young woman entered the room asking where to find one of the researchers.         This woman had been chosen by the researchers  In jeans she  They stared at her looked her up and down rolled their eyes and sometimes showed outright anger. One asked her in disgust What the [expletive] is that?         Most of the aggression though happened after she left the room. Then the students laughed about her and impugned her motives. One student suggested that she dressed that way in order to have sex with a professor. Another said that her breasts were about to pop out.         The results of the experiment jibe with evidence that this mean girl form of indirect aggression is used more by adolescents and young women than by older women who have less incentive to handicap rivals once they marry. Other studies have shown that the more attractive an adolescent girl or woman is the more likely she is to become  Women are indeed very capable of aggressing against others especially women they perceive as rivals said Dr. Vaillancourt now a psychologist at the University of Ottawa. The research also shows that suppression of female sexuality is by women not necessarily by men.         Stigmatizing female promiscuity  a.k.a. slut-shaming  has often been blamed on men who have a Darwinian incentive to discourage their spouses from straying. But they also have a Darwinian incentive to encourage other women to be promiscuous. Dr. Vaillancourt said the experiment and other research suggest  Sex is coveted by men she said. Accordingly women limit access as a way of maintaining advantage in the negotiation of this resource. Women who make sex too readily available compromise the power-holding position of the group which is why many women are particularly intolerant of women who are or seem to be promiscuous.         Indirect aggression can take a psychological toll on women who are ostracized or feel pressured to meet impossible standards like the vogue of thin bodies in many modern societies. Studies have shown that womens ideal body shape is to be thinner than average  and thinner than what men consider the ideal shape to be. This pressure is frequently blamed on the ultrathin female role models featured in magazines and on television but Christopher J. Ferguson and other researchers say that its mainly  To a large degree the media reflects trends that are going on in society not creates them said  But he found that women were more likely to feel worse when they compared themselves with peers in their own social circles or even if they were in a room with a thin stranger like the assistant to Dr. Ferguson who ran  Sexual competition among females seems to increase due to circumstances that tend to be particularly common in affluent societies Dr. Ferguson said.         In traditional villages people married at an early age to someone nearby but young men and women in modern societies are free to postpone marriage as they search long and far for better options. The result is more competition because there are so many more rivals  and theres no longer any scientific doubt that both sexes are in to win it.        
1,100000002581357,1,Article,News,Science,science,,"Baffling 400,000-Year-Old Clue to Human Origins",CARL ZIMMER,,http://www.nytimes.com/2013/12/05/science/at-400000-years-oldest-human-dna-yet-found-raises-new-mysteries.html,10,Scientists have found the oldest DNA evidence yet of humans biological history. But instead of neatly clarifying human evolution the finding is adding new mysteries.         In a paper in the journal Nature scientists  The fossil a thigh bone found in Spain had previously seemed to many experts to belong to a forerunner of Neanderthals. But its DNA tells a very different story. It most closely resembles DNA from an enigmatic lineage of humans known as Denisovans. Until now Denisovans were known only from DNA retrieved from 80000-year-old remains in Siberia 4000 miles east of where the new DNA was found.         The mismatch between the anatomical and genetic evidence surprised the scientists who are now rethinking human evolution over the past few hundred thousand years. It is possible for example that there are many extinct human populations that scientists have yet to discover. They might have interbred swapping DNA. Scientists hope that further studies of extremely ancient human DNA will clarify the mystery.         Right now weve basically generated a big question mark said Matthias Meyer a geneticist at the Max Planck Institute for Evolutionary Anthropology in Leipzig Germany and a co-author of the new study.         Hints at new hidden complexities in the human story came from a 400000-year-old femur found in a cave in Spain called Sima de los Huesos (the pit of bones in Spanish). The scientific team used new methods to extract the ancient DNA from the fossil.         This would not have been possible even a year ago said Juan Luis Arsuaga a paleoanthropologist at Universidad Complutense de Madrid and a co-author of the paper.         Finding such ancient human DNA was a major advance said David Reich a geneticist at Harvard Medical School who was not involved in the research. Thats an amazing game-changing thing he said.         Since the 1970s Spanish scientists have brought out a wealth of fossils from the cave dating back hundreds of thousands of years. The place is very special said Dr. Arsuaga who has found 28 nearly complete skeletons of humans during three decades of excavations.         Based on the anatomy of the fossils Dr. Arsuaga has argued that they belonged to ancestors of Neanderthals which lived in western Asia and Europe from about 200000 to 30000 years ago.         When Dr. Meyer and his colleagues drilled into the femur they found ancient human DNA inside just as they had hoped.         Our expectation was that it would be a very early Neanderthal Dr. Meyer said.         But the DNA did not match that of Neanderthals. Dr. Meyer then compared it to the DNA of the Denisovans the ancient human lineage that he and his colleagues had discovered in Siberia in 2010. He was shocked to find that it was similar.         Everybody had a hard time believing it at first Dr. Meyer said. So we generated more and more data to nail it down.         The extra research confirmed that the DNA belonged on the Denisovan branch of the human family tree.         The new finding is hard to reconcile with the picture of human evolution that has been emerging based on fossils and ancient DNA. Denisovans were believed to be limited to East Asia and they were not thought to look so Neanderthal-like.         Based on previously discovered ancient DNA and fossil evidence scientists generally agreed that humans direct ancestors shared a common ancestor with Neanderthals and Denisovans that lived about half a million years ago in Africa.         Their shared ancestors split off from humans lineage and left Africa then split further into the Denisovans and Neanderthals about 300000 years ago. The evidence suggested that Neanderthals headed west toward Europe and that the Denisovans moved east.         Humans ancestors meanwhile stayed in Africa giving rise to Homo sapiens about 200000 years ago. Humans then expanded from Africa into Asia and Europe about 60000 years ago. They then interbred not only with Neanderthals but with Denisovans too. Later both the Denisovans and Neanderthals became extinct.         Now we have to rethink the whole story Dr. Arsuaga said.         Dr. Arsuaga doubts that Denisovans were spread out across so much of the Old World from Spain to Siberia masquerading as Neanderthals.         One alternative explanation is that the humans of Sima de los Huesos were not true Neanderthals but belonged to the ancestors of both Denisovans and Neanderthals.         It is also possible that the newly discovered DNA was passed to both Neanderthals and Denisovans but eventually disappeared from Neanderthals replaced by other variants.         It got lost in one lineage but made its way in the other suggested Jean-Jacques Hublin a Max Planck paleoanthropologist who was not involved in the research.         Beth Shapiro an expert on ancient DNA at the University of California Santa Cruz favors an even more radical possibility: that the humans of Sima de los Huesos belong to yet another branch of humans. They might have been a species called Homo erectus which originated about 1.8 million years ago and became extinct within the last few hundred thousand years.         The more we learn from the DNA extracted from these fossils the more complicated the story becomes Dr. Shapiro said.         This complicated story has come to light only because of advances over the past 20 years in retrieving ancient DNA.         When an organism dies its DNA breaks down into smaller and smaller fragments while also becoming contaminated with the DNA of other species like soil bacteria. So piecing the fossil DNA together is a bit like putting together a jigsaw puzzle created by a sadist.         In 1997 Svante Paabo of the Max Planck Institute and his colleagues who had pioneered the techniques for retrieving DNA fragments  In 2006 a team of French and Belgian researchers obtained a fragment of Neanderthal DNA dating back  Meanwhile using improved methods Dr. Paabo Dr. Meyer and their colleagues  That discovery shed light on how Neanderthals and humans ancestors split from a common ancestor hundreds of thousands of years ago. It also revealed that Neanderthals and humans interbred  Around the same time as that discovery Russian collaborators sent the Max Planck team 80000-year-old fossils they had found in a cave in Siberia called Denisova. When the German scientists sequenced the entire genome from the finger bone of a girl it turned out to be neither human nor Neanderthal but from a  Dr. Meyer is hopeful that he and his colleagues will be able to get more DNA from the Spanish fossil as well as other fossils from the site to help solve the puzzle they have now stumbled across. Its extremely hard to make sense of Dr. Meyer said. We still are a bit lost here.        
2,100000002555962,1,Article,News,World,world,europe,A Russian GPS Using U.S. Soil Stirs Spy Fears,MICHAEL S. SCHMIDT;ERIC SCHMITT,,http://www.nytimes.com/2013/11/17/world/europe/a-russian-gps-using-us-soil-stirs-spy-fears.html,1,WASHINGTON  In the view of Americas spy services the next potential threat from  Instead this menace may come in the form of a seemingly innocuous dome-topped antenna perched atop an electronics-packed building surrounded by a security fence somewhere in the United States.         In recent months the  They fear that these structures could help Russia spy on the United States and improve the precision of Russian weaponry the officials said. These monitor stations the Russians contend would significantly improve the accuracy and reliability of Moscows version of the Global Positioning System the American satellite network that steers guided missiles to their targets and thirsty smartphone users to the nearest Starbucks.         They dont want to be reliant on the American system and believe that their systems like GPS will spawn other industries and applications said a former senior official in the State Departments Office of Space and Advanced Technology. They feel as though they are losing a technological edge to us in an important market. Look at everything GPS has done on things like your phone and the movement of planes and ships.         The Russian effort is part of a larger global race by several countries  including China and European Union nations  to perfect their own global positioning systems and challenge the dominance of the American GPS.         For the State Department permitting Russia to build the stations would help mend the Obama administrations relationship with the government of President Vladimir V. Putin now at a nadir because of Moscows granting asylum to Mr. Snowden and its backing of President Bashar al-Assad of Syria.         But the C.I.A. and other American spy agencies as well as the Pentagon suspect that the monitor stations would give the Russians a foothold on American territory that would sharpen the accuracy of Moscows satellite-steered weapons. The stations they believe could also give the Russians an opening to snoop on the United States within its borders.         The squabble is serious enough that administration officials have delayed a final decision until the Russians provide more information and until the American agencies sort out their differences State Department and White House officials said.         Russias efforts have also stirred concerns on Capitol Hill where members of the intelligence and armed services committees view Moscows global positioning network  known as Glonass for Global Navigation Satellite System  with deep suspicion and are demanding answers from the administration.         I would like to understand why the United States would be interested in enabling a GPS competitor like Russian Glonass when the worlds reliance on GPS is a clear advantage to the United States on multiple levels said Representative Mike D. Rogers Republican of Alabama the chairman of a House Armed Services subcommittee.         Mr. Rogers last week asked the Pentagon to provide an assessment of the proposals impact on national security. The request was made in a letter sent to Defense Secretary Chuck Hagel Secretary of State John Kerry and the director of national intelligence James R. Clapper Jr.         The monitor stations have been a high priority of Mr. Putin for several years as a means to improve Glonass not only to benefit the Russian military and civilian sectors but also to compete globally with GPS.         Earlier this year Russia positioned a station in Brazil and agreements with Spain Indonesia and Australia are expected soon according to Russian news reports. The United States has stations around the world but none in Russia.        
3,100000002579524,1,Article,News,N.Y. / Region,nyregion,,Focus Turns to Investigation in Fatal Bronx Train Crash,JAMES BARRON;J. DAVID GOODMAN,,http://www.nytimes.com/2013/12/02/nyregion/metro-north-derailment.html,1,The 5:54 from Poughkeepsie was rumbling through the Bronx on Sunday morning. Only 100 to 150 people were onboard  department store employees who were bracing for another busy after-Thanksgiving day tourists from Texas who wanted to climb the Statue of Liberty a police officer moonlighting as a security guard on his day off.         Some were dozing when the train rounded a bend near where tracks pass under the Henry Hudson Bridge. Some were listening to music on headphones. Suddenly with a jerk that disrupted the steady trains steady rhythm their world turned upside down as they were hurled from one side to the other.         In the chaos of screeching metal and the shower of debris as the train kept plowing along some passengers grabbed for the luggage racks and held on. Others hugged their seats as the eight cars of the train flew off the tracks and several landed on their sides.         Im thinking Im going into the water said Eddie Russell 48 who had been listening with his eyes closed to LL Cool J. I was thinking of me surviving.         Police and transit officials said four people on board were killed and more than 60 were injured 11 critically. Three of the four dead were thrown from the train after the windows blew out the officials said.         It was not clear how fast the Metro-North train was going. But an official from the Metropolitan Transportation Authority said the train operator had reported that the train was going into the turn too fast and that he had performed an emergency braking maneuver.         The operator told the first rescuers to reach the scene that he had dumped the brakes according to the official who spoke on the condition of anonymity.         Dumping the brakes railroad experts said is a last-resort move that has the effect of slamming on the emergency brakes on all the cars of a train at once. It is usually done to avert a collision with another train or a vehicle at a grade-level crossing.         Officials opened an investigation but cautioned that it would take time to piece together the evidence and identify a possible cause. The National Transportation Safety Board sent investigators to the site with instructions to inspect the overturned cars and interpret information from the trains event recorders devices that are somewhat similar to the flight recorders on airplanes. The Federal Railroad Administration also dispatched a team of investigators.         Earl F. Weener of the transportation safety board said at a morning news conference with Gov. Andrew M. Cuomo that investigators had yet to interview the operator of the train who was among those injured. A spokeswoman for Metro-North said the engineer identified as William Rockefeller of Germantown N.Y. had about 14 years experience with the line. There were also three conductors on the train.         Our mission is to not just understand what happened but why it happened with the intent of preventing it from happening again Mr. Weener said.         The accident was the latest episode in a trying year for Metro-North the nations second-largest commuter railroad and the first with passenger fatalities in Metro-Norths 30-year history.         In May two Metro-North trains slammed into each other near Fairfield Conn. during the evening rush. Scores of passengers were hurt five critically.         And in July a CSX freight train derailed near where the Metro-North train left the tracks on Sunday. Officials said there was no connection between the accidents.         By Sunday night the transportation safety board had given Metro-North clearance to begin removing the crippled train and repairing the tracks. But the crash was likely to disrupt the Monday commute for thousands of passengers on the railroads Hudson line. Metro-North arranged for buses to take Hudson line passengers to White Plains N.Y. on Sunday to catch trains on a different line that was running normally. On Monday Hudson line trains will be running as far south as Yonkers where passengers will be able to catch buses to the 242nd Street station of the No. 1 train.        
