,article_id,popular,content_type,genre,section_formal,section,sub-category,title,author,post_length,url,page_num,text
34,100000002145007,1,Article,News,World,world,africa,Mandela’s Death Leaves South Africa Without Its Moral Center,LYDIA POLGREEN,,http://www.nytimes.com/2013/12/06/world/africa/nelson-mandela.html,14,JOHANNESBURG  Nelson Mandela South Africas first black president and an enduring icon of the struggle against racial oppression died on Thursday the government announced leaving the nation without its moral center at a time of growing dissatisfaction with the countrys leaders.         Our nation has lost its greatest son President Jacob Zuma said in a televised address late Thursday night adding that Mr. Mandela had died at 8:50 p.m. local time. His tireless struggle for freedom earned him the respect of the world. His humility his compassion and his humanity earned him their love.         Mr. Zuma called Mr. Mandelas death the moment of our deepest sorrow and said that South Africas thoughts were now with the former presidents family. They have sacrificed much and endured much so that our people could be free he said.         Mr. Mandela spent 27 years in prison after being convicted of treason by the white minority government only to forge a peaceful end to white rule by negotiating with his captors after his release in 1990. He led the African National Congress long a banned liberation movement to a resounding electoral victory in 1994 the first fully democratic election in the countrys history.         Mr. Mandela who was 95 served just one term as South Africas president and had not been seen in public since 2010 when the nation hosted the soccer World Cup. But his decades in prison and his insistence on forgiveness over vengeance made him a potent symbol of the struggle to end this countrys brutally codified system of racial domination and of the power of peaceful resolution in even the most intractable conflicts.         Years after he retreated from public life his name still resonated as an emblem of his effort to transcend decades of racial division and create what South Africans called a Rainbow Nation.         His commitment to transfer power and reconcile with those who jailed him set an example that all humanity should aspire to a grim President Obama said Thursday evening describing Mr. Mandela as an influential courageous and profoundly good man who inspired millions  including himself  to a spirit of reconciliation.         Mr. Mandela and Mr. Obama both served as the first black leaders of their nations and both men won the Nobel Peace Prize. But the American president has shied away from comparisons often noting that his own sacrifices would never compare to the ones that Mr. Mandela endured.         Mr. Obama said that the world would not likely see the likes of Nelson Mandela again and he noted that the former South African president had once said that he was not a saint unless you think of a saint as a sinner who keeps on trying.         Mr. Zuma did not announce the specific cause of Mr. Mandelas death but he had battling pneumonia and other lung ailments for the past six months and had been in and out of the hospital. Though his death was announced close to midnight when most in this nation of early risers are asleep a small crowd quickly gathered outside the house where he once lived in Soweto on Vilekazi Street.         Nelson Mandela there is no one like you they sang stamping their feet in unison to a praise song usually sung in joy. But in the midnight darkness sadness tinged the melody.         He was our father our mother our everything said Numfundo Matli 28 a housekeeper who joined the impromptu celebration of Mr. Mandelas life. What will we do without him?         His death comes during a period of deep unease and painful self-examination for South Africa.         In the past year and a half the country has faced perhaps its most serious unrest since the end of apartheid provoked by a wave of wildcat  Scandals over corruption involving senior members of the party have fed a broader perception that Mr. Mandelas near saintly legacy from the years of struggle has been eroded by a more recent scramble for self-enrichment among a newer elite.         After spending decades in penurious exile many political figures returned to find themselves at the center of a grab for power and money. Mr. Zuma himself was charged with corruption before rising to the presidency in 2009 though the charges were dropped on largely technical grounds. He has 
35,100000002557948,1,Article,News,Health,health,,Sleep Therapy Seen as an Aid for Depression,BENEDICT CAREY,,http://www.nytimes.com/2013/11/19/health/treating-insomnia-to-heal-depression.html,1,Curing insomnia in people with depression could double their chance of a full recovery scientists are reporting. The findings based on an insomnia treatment that uses talk therapy rather than drugs are the first to emerge from a series of closely watched studies of sleep and depression to be released in the coming year.         The new report affirms the results of a smaller pilot study giving scientists confidence that the effects of the insomnia treatment are real. If the figures continue to hold up the advance will be the most significant in the treatment of depression since the introduction of Prozac in 1987.         Depression is the most common mental disorder affecting some 18 million Americans in any given year according to government figures and more than half of them also have insomnia.         Experts familiar with the new report said that the results were plausible and that if supported by other studies they should lead to major changes in treatment.         It would be an absolute boon to the field said Dr. Nada L. Stotland professor of psychiatry at Rush Medical College in Chicago who was not connected with the latest research.         It makes good common sense clinically she continued. If you have a depression youre often awake all night its extremely lonely its dark youre aware every moment that the world around you is sleeping every concern you have is magnified.         The study is the first of four on sleep and depression nearing completion all financed by the  The new report from a team at Ryerson University in Toronto found that 87 percent of patients who resolved their insomnia in four biweekly talk therapy sessions also saw their depression symptoms dissolve after eight weeks of treatment either with an antidepressant drug or a placebo pill  almost twice the rate of those who could not shake their insomnia. Those numbers are in line with a previous pilot study of insomnia treatment at Stanford.         In an interview the reports lead author  Dr. Carney acknowledged that the study was small  just 66 patients  and said a clearer picture should emerge as the other teams of scientists released their results. Those studies are being done at Stanford Duke and the University of Pittsburgh and include about 70 subjects each. Dr. Carney will present her data on Saturday at a convention of the Association for Behavioral and Cognitive Therapies in Nashville.         Doctors have known for years that sleep problems are intertwined with mood disorders. But only recently have they begun to investigate the effects of treating both at the same time. Antidepressant drugs like Prozac help many people as does talk therapy but in rigorous studies the treatments administered individually only slightly outperform placebo pills. Used together the treatments produce a cure rate  full recovery  for about 40 percent of patients.         Adding insomnia therapy however to an antidepressant would sharply lift the cure rate Dr. Carneys data suggests as do the findings from the Stanford pilot study which included 30 people.         Doctors have long considered poor sleep to be a symptom of depression that would clear up with treatments said Rachel Manber a professor in the psychiatry and behavioral sciences department at Stanford whose 2008 pilot trial of insomnia therapy provided the rationale for larger studies. But we now know thats not the case she said. The relationship is bidirectional  that insomnia can precede the depression.         Full-blown insomnia is more serious than the sleep problems most people occasionally have. To qualify for a diagnosis people must have endured at least a month of chronic sleep loss that has caused problems at work at home or in important relationships. Several studies now suggest that developing insomnia doubles a persons risk of later becoming depressed  the sleep problem preceding the mood disorder rather than the other way around.        
36,100000002558075,1,Article,News,Sports,sports,football,"Quitting the N.F.L.: For John Moffitt, the Money Wasn’t Worth It",KEN BELSON,,http://www.nytimes.com/2013/11/19/sports/football/quitting-the-nfl-for-john-moffitt-the-money-wasnt-worth-it.html,12,SEATTLE  John Moffitt chugged mugs of black coffee and talked almost giddily about how the week before he called John Elway the head of football operations for the  In parts of three seasons as a guard with the  I dont want to risk health for money said Moffitt who walked away from about $1 million in salary various benefits for retirees who play at least three seasons and quite possibly a trip to the Super Bowl with the 9-1 Broncos. Im happy and I dont need the N.F.L.         Most weeks the departure of a player like Moffitt who played sporadically and often anonymously on the offensive line would have warranted barely a footnote among fans and general managers and his spot on the roster would have been quickly filled by an eager replacement.         But Moffitt quit the same week that the N.F.L. was consumed by allegations of bullying on the Miami Dolphins and disturbing reports that the former Dallas Cowboys running back Tony Dorsett and other retired stars might have early onset degenerative brain disease.         The heightened awareness of footballs physical tolls has prompted hundreds of former players to express regret over what the sport did to their bodies.Â Yet Moffitt is unique for openly discussing his injuries and the brutal reality of playing in the N.F.L.Â          They are merchandising human beings lets be honest said MoffittÂ who at a cafe in Pike Place Market in Seattle reveled in his freedom much like the Tim Robbins character in The Shawshank Redemption who after breaking out of jail rips off his shirt in the rain and laughs at the sky.         In a far-reaching interview last week Moffitt described how his decision to leave the N.F.L. a level he worked so hard to reach was far from rash even though he announced it on Twitter and was accused online of being impulsive and naÃ¯ve.         Quitting he said had little to do with his diminished playing time though he suited up for only two games this season or any dissatisfaction with the Seahawks or Broncos organizations which he said treated him well.         Rather it was the culmination of months of reflection that his once-promising career had been derailed by injuries and that continuing to play for the money and to please others would very likely ruin his health further and deepen his gloom.         In the off-season after battling for playing time and trying to stay fit Moffitt a free spirit who idolizes Jim Morrison started reading the writings of the Dalai Lama and Noam Chomsky among others. They helped him conclude that he was a pawn in a machine that controlled his life and that he no longer wanted to meet the expectations attached to that life.         You kind of let go of that dream that you kill yourself for to be a millionaire and you see through it and see that its just a facade said Moffitt who was dressed in baggy jeans T-shirt work boots and black pea coat. I let go of all that stuff.         Moffitt returned to training camp harboring doubts. In August the Seahawks traded him to Cleveland but the deal was reversed because the Browns said they had concerns about his health. Moffitt said the Browns voided the trade because he refused to take a pay cut something the team denied.         So the Seahawks traded Moffitt to the Broncos for whom he had an opportunity to protect Peyton Manning probably the N.F.L.s biggest star. To outsiders it was a dream job with a near-certain trip to the playoffs. But the trade only confirmed to Moffitt that he did not control his destiny.         His love of the game changed because its a business in the N.F.L. his father Dave Moffitt said. The minute he signed I told him: Youre John Moffitt Inc. The rah-rah is great for the fans but you have to treat yourself as a business.        
37,100000002545716,1,Article,News,Magazine,magazine,,Switzerland’s Proposal to Pay People for Being Alive,ANNIE LOWREY,,http://www.nytimes.com/2013/11/17/magazine/switzerlands-proposal-to-pay-people-for-being-alive.html,18,This fall a truck dumped eight million coins outside the Parliament building in Bern one for every Swiss citizen. It was a publicity stunt for advocates of an audacious social policy that just might become reality in the tiny rich country. Along with the coins activists delivered 125000 signatures  enough to trigger a Swiss public referendum this time on providing a monthly income to every citizen no strings attached. Every month every Swiss person would receive a check from the government no matter how rich or poor how hardworking or lazy how old or young. Poverty would disappear. Economists needless to say are sharply divided on what would reappear in its place  and whether such a basic-income scheme might have some appeal for other less socialist countries too.         The proposal is in part the brainchild of a German-born artist named Enno Schmidt a leader in the basic-income movement. He knows it sounds a bit crazy. He thought the same when someone first described the policy to him too. I tell people not to think about it for others but think about it for themselves Schmidt told me. What would you do if you had that income? What if you were taking care of a child or an elderly person? Schmidt said that the basic income would provide some dignity and security to the poor especially Europes underemployed and unemployed. It would also he said help unleash creativity and entrepreneurialism: Switzerlands workers would feel empowered to work the way they wanted to rather than the way they had to just to get by. He even went so far as to compare it to a civil rights movement like womens suffrage or ending slavery.         When we spoke Schmidt repeatedly described the policy as  Go to a cocktail party in Berlin and there is always someone spouting off about the benefits of a basic income just as you might hear someone talking up Robin Hood taxes in New York or single-payer health care in Washington. And its not only in vogue in wealthy Switzerland. Beleaguered and debt-wracked Cyprus is weighing the implementation of basic incomes too. They even are whispered about in the United States where certain wonks on the libertarian right and liberal left have come to a strange convergence around the idea  some prefer an unconditional basic income that would go out to everyone no strings attached; others a means-tested minimum income to supplement the earnings of the poor up to a given level.         The case from the right is one of expediency and efficacy. Lets say that Congress decided to provide a basic income through the tax code or by expanding the Social Security program. Such a system might work better and be fairer than the current patchwork of programs including welfare food stamps and housing vouchers. A single father with two jobs and two children would no longer have to worry about the hassle of visiting a bunch of offices to receive benefits. And giving him a single lump sum might help him use his federal dollars better. Housing vouchers have to be spent on housing food stamps on food. Those dollars would be more valuable  both to the recipient and the economy at large  if they were fungible.         Even better conservatives think such a program could significantly reduce the size of our federal bureaucracy. It could take the place of welfare food stamps housing vouchers and hundreds of other programs all at once: Hello basic income; goodbye H.U.D. Charles Murray of the conservative American Enterprise Institute has proposed a minimum income for just that reason  feed the poor and starve the beast. Give the money to the people Murray wrote in his book In Our Hands: A Plan to Replace the Welfare State. He suggested guaranteeing $10000 a year to anyone meeting the following conditions: be American be over 21 stay out of jail and  as he once quipped  have a pulse.        
38,100000002594987,0,Article,News,Home & Garden,garden,,Kenny Irwin’s Creations on View in Baltimore,STEVEN KURUTZ,165,http://www.nytimes.com/2013/12/10/garden/kenny-irwins-creations-on-view-in-baltimore.html,,For years Southern Californians have flocked at Christmastime to the Palm Springs yard of  The installation includes among many other sci-fi-inspired creations a Cyclopto snowman; a full-scale spaceship built with slot machine parts and topped with a spinning carousel; a pathway of peppermint skulls lit on either side with 12000 colorful balls; and a Christmas tree decorated with ornaments made from microwaved electronic gadgets.         The tree itself is beautifully decorated with LED lights fused with glue Mr. Irwin said. There is a giant parasitic sea slug on there.         What does any of this have to do with eggnog and the story of Jolly Old St. Nick? Does it matter? Information: 
39,100000002593949,0,Article,Review,Arts,arts,music,"The New, in Context, for Ear, Heart and Brain",CORINNA da FONSECA-WOLLHEIM,415,http://www.nytimes.com/2013/12/10/arts/music/dolce-suono-ensemble-and-lucy-shelton-at-roulette.html,,From ancient Greece to the moon by way of Monteverdi Mahler and Puccini: Wednesday evenings concert by the  Ms. Stillman who founded the group is not only a consummate and charismatic performer but also a scholar. Her programs tend to activate ear heart  and brain. Wednesday evenings program of new chamber cantatas by Jeremy Gill and Shulamit Ran alongside instrumental works by Roussel Messiaen and Daniel CatÃ¡n was both sonically seductive and thought-provoking as it explored the fluid border between the lyric and the dramatic.         Both qualities are concentrated in the soprano  In Mr. Gills Ode: A Dramatic Cantata Ms. Shelton drew on expressive modes from dramatic spoken recitation to ringing fortes and softly floated high notes.         The piece sets Greek texts by Pindar and Mesomedes as well as English ones by Keats and Wordsworth to a vividly colored instrumental score for piano cello and flute. It weaves in fragmented and subtly distorted echoes of Monteverdis Orfeo Puccinis Tosca and Mahlers RÃ¼ckert Lieder. There was a close connection between music and text  the latter projected onto a screen  even in the instrumental passages where Gabriel Cabezass cello underwent a number of sonic transformations.         Ms. Rans entrancing Moon Songs: A Song Cycle in Four Acts was commissioned by Dolce Suono in 2011 as a dual tribute to Mahler and Schoenberg and written for Ms. Shelton. The work draws on texts about the moon in biblical and modern Hebrew as well as English and includes translations of Li Bai the eighth-century Chinese poet who also inspired Mahlers Das Lied von der Erde.         Through the use of gestures sound-painting expressive melodies spoken word and percussive effects the three instrumentalists and Ms. Shelton revealed the ritualistic origins of poetry.        
40,100000002587374,0,Article,News,U.S.,us,politics,More Dysfunction in Washington? Blame Geography.,SAM TANENHAUS,239,http://www.nytimes.com/2013/12/10/us/politics/more-dysfunction-in-washington-blame-geography.html,,House and Senate negotiators are nearing a  A major reason is that until quite recently the two parties interests were better aligned in part because geography trumped ideology.         In the 1940s and 50s the South with its military tradition and its many Army bases was a stronghold of support for robust interventions in World War II and then the Cold War even as northern Democrats joined Midwestern Republicans in favoring a more cautious foreign policy. At the same time when the first modern civil rights legislation was passed -- in the 1950s and 60s -- Republicans in the North were as much opposed to Jim Crow policies as northern Democrats while the staunchest opposition came from Democrats in the Deep South.         Following the passage of the Civil Rights Act of 1964 Republicans began to make inroads into the Solid South and shifted the partys axis along the Sun Belt. The northern moderate Republicans of the previous decades either left the party or were replaced by conservatives. The Democratic Party also became more ideologically cohesive. In subsequent years this trend has continued with the result that bipartisanship has become increasingly rare.        
41,100000002593194,0,Article,News,Booming,booming,,"Joni Mitchell’s ‘Woodstock,’ by Heather Maloney and Darlingside",VAL HALLER,281,http://www.nytimes.com/2013/12/10/booming/joni-mitchells-woodstock-by-heather-maloney-and-darlingside.html,," Were you at  I hosted a house concert last month featuring a singer-songwriter from Massachusetts    Joni Mitchell - Woodstock (Live In-Studio 1970)  CROSBY STILLS NASH Woodstock 1971  Woodstock (Joni Mitchell) - Darlingside & Heather Maloney  Heather Maloney - Nightstand Drawer (Live at The Academy of Music) ""Flutter"" by Heather Maloney  Darlingside - Blow The House Down Darlingside ""The Ancestor"" Live from Studio D"
