,article_id,popular,content_type,genre,section_formal,section,sub-category,title,author,post_length,url,page_num,text
23,100000002557161,1,Article,News,Sports,sports,,A Deep-Water Diver From Brooklyn Dies After Trying for a Record,ADAM SKOLNICK,,http://www.nytimes.com/2013/11/18/sports/deep-water-diver-from-brooklyn-dies-after-trying-for-a-record.html,1,LONG ISLAND Bahamas  As Nicholas Mevoli lay on his back floating in the azure sea attempting to relax his exhales were audible. The countdown had begun and he prepared to dive into Deans Blue Hole hoping to reach 72 meters on a single inhalation with no fins or supplemental oxygen. He began sipping the air attempting to pack as much oxygen in his lungs as possible.         At 12:25 p.m. Sunday surrounded by 15 other athletes and observers as well as five safety divers he turned and submerged face first and looking like a human arrow shooting into the darkness on what would be the last dive of his life.         Officials for Vertical Blue a  Diving to that depth with no fins thats a hard physical dive said Mike Board the British record-holder. I was thinking O.K. hes going to have a hard time getting up.         Still Mevoli shot to the surface under his own power after a dive of 3 minutes 38 seconds. Thats when the scene turned nightmarish.         Mevoli ripped off his goggles flashed the O.K. sign and attempted to complete the surface protocol that would make his attempt official by saying I am O.K. But he wasnt. His words were garbled his eyes wide and blank. He tipped backward into the ocean and lost consciousness which while alarming is not unheard-of in a sport in which almost all the top athletes have lost consciousness at one time or another though usually for only a few seconds. Mevoli was not so fortunate.         Five safety divers one of them an Australian paramedic and all certified in life support techniques hefted him onto a nearby platform where the event physician Barbara Jeschke of Germany went to work trying to revive him.         Theres a problem with his lung shouted Marco Cosentino of Italy one of the safety divers who meet the competitors at various stages to help bring them to the surface if they are in distress. They turned Mevoli onto his side and blood began pouring from his mouth and pooling on the platform before dissipating into the sea.         At first there was a pulse at times faint at times strong. Within 15 minutes there was none. The team cut off his wetsuit and began cardiopulmonary resuscitation in earnest. Attempts to revive Mevoli which included three shots of adrenaline at the scene continued unsuccessfully for the next 90 minutes.         Mevoli 32 from Williamsburg Brooklyn was a relative newcomer to the sport. When he dived to 100 meters in May he became the first American to break that barrier unassisted. He used a monofin that day and completed the feat in 3:45. It is this type of free diving  rather than the variety known as variable weight which uses a sled to take divers deeper than they could ever get on their own  that has exploded in popularity in recent years. Internationally free-diving schools are multiplying in destinations as wide-ranging as Hawaii Egypt Indonesia Greece and the Bahamas.         Vertical Blue considered the Wimbledon of free diving is an annual event that attracts the sports top athletes. It is held in a unique arena: Deans Blue Hole a narrow 200-meter-deep limestone pit the deepest of its kind in the world. It is set in a cove backed by cliffs that spill into a turquoise bay. The bay laps the shore of an egg noodle of an island that is 72 miles long home to 4000 people and under the tourism radar.         This year 34 athletes came to compete representing 16 countries with 26 national records set in the first six days of a competition that was scheduled to end on Tuesday. Athletes compete in 
24,HCD/KEuUcIEWARm2vzHDkw,1,Blogs,Blog Post,Health,Health,well,Why a Brisk Walk Is Better,GRETCHEN REYNOLDS,,http://well.blogs.nytimes.com/2013/12/04/why-a-brisk-walk-is-better/,,Walking fast or slow is wonderful exercise. But now a first-of-its-kind study shows that to get the most health benefits from walking many of us need to pick up the pace. The findings stem from a new analysis of the National Walkers’ Health Study a large database of information maintained at the Lawrence Berkeley National Laboratory about thousands of middle-age men and women who walk regularly for exercise. Recruited beginning in 1998 at walking events and from lists of subscribers to walking-related publications these volunteers filled out a lengthy survey about their typical walking distance and pace as well as their health history and habits. As most of us would likely guess walking is the most popular physical activity in America. But people who walk for exercise do so at wildly varying speeds and intensities. Some stroll at a leisurely 2 miles per hour which is low-intensity exercise. Others zip along at twice that pace or better resulting in a sweatier workout.  Exercise guidelines generally suggest that for health purposes people should engage in 30 minutes of moderate-intensity activity most days of the week. For walkers a moderately intense pace would probably be about 15 or 16 minutes per mile. It has generally been assumed that if people walk more slowly but expend the same total energy as brisk walkers — meaning that they spend more time walking — they should gain the same health benefits. But few large-scale studies have directly compared the impact of moderate- and light-intensity walking especially in terms of longevity.    To do so Paul T. Williams a statistician at Lawrence Berkeley National Laboratory gathered data about 7374 male and 31607 female participants from the walkers’ health study who represented almost every speed of fitness walker from sluggish to swift. His findings were  Dr. Williams divided participants into four numerically equal categories based on their normal pace. Those in Category 1 the fleetest averaged less than 13.5 minutes per mile putting them on the cusp of jogging while those in Category 4 the slowest strolled at a relatively dilatory 17 minutes or more per mile. The majority of the walkers in this group in fact required at least 20 minutes to complete a mile and many had a pace of 25 minutes or more per mile. (Interestingly on average female walkers were faster than men in all of the categories.)  Next Dr. Williams cross-referenced his data against that in the essential if somewhat ghoulish National Death Index to determine which of the almost 39000 walkers had died in the decade or so since they had joined the survey and from what. It turned out that nearly 2000 of the walkers had died. More telling these deaths disproportionately were clustered among the slowest walkers. Those in Category 4 were about 18 percent more likely to have died from any cause than those in the other three categories and were particularly vulnerable to deaths from heart disease and dementia.  Unexpectedly the death rate remained high among the slowest walkers even if they met or exceeded the standard exercise guidelines and expended as much energy per day as someone walking briskly for 30 minutes. This effect was most pronounced among the slowest of the slow walkers whose pace was 24 minutes per mile or higher. They were 44 percent more likely to have died than walkers who moved faster even if they met the exercise guidelines. One important inference of these statistics is that intensity matters if you are walking for health. “Our results do suggest that there is a significant health benefit to pursuing a faster pace” Dr. Williams said. Pushing your body he said appears to cause favorable physiological changes that milder exercise doesn’t replicate. But there are nuances and caveats to that conclusion. The slowest walkers may have harbored underlying health conditions that predisposed them to both a tentative walking pace and early death. But that possibility underscores a subtle takeaway of the new study Dr. Williams said. Measuring your walking speed he pointed out could provide a barometer of your health status.  So check yours your spouse’s or perhaps your parents’ pace. The process is easy. Simply find a 400-meter track and using a stopwatch have everyone walk at his or her normal speed. If a circuit of the track takes someone 6 minutes or more that person’s pace is 24 minutes per mile or slower and he or she might consider consulting a doctor about possible health issues Dr. Williams said.  Then with medical clearance the slow walkers probably should try ramping up their speed gradually.  The most encouraging news embedded in the new study is that longevity rises with small improvements in pace. The walkers in Category 3 for instance moved at a speed only a minute or so faster per mile than some of those in the slowest group but they enjoyed a significant reduction in their risk of dying prematurely. Gretchen Reynolds on the science of fitness. All open questions » Marathon half-marathon 10k and 5K training plans to get you race ready. How much do you know about the amazing things that go on in your gut? Test your knowledge of flu facts and trivia.
25,100000002572844,1,Article,News,World,world,asia,U.S. Sends Two B-52 Bombers Into Air Zone Claimed by China,THOM SHANKER,,http://www.nytimes.com/2013/11/27/world/asia/us-flies-b-52s-into-chinas-expanded-air-defense-zone.html,1,WASHINGTON  Defying China two long-range American bombers flew through contested airspace over the East China Sea days after the Chinese announced they were claiming the right to police the sky above a vast area that includes islands at the center of a simmering dispute with Japan.         Pentagon officials said Tuesday that the B-52s were on a routine training mission planned long in advance of the Chinese announcement on Saturday that it was  A senior Pentagon official said that the mission overnight Monday from Guam was a demonstration of long-established international rights to freedom of navigation and transit through international airspace. The official said the unilateral Chinese declaration of expanded control was provocative and only increases the risk of miscalculation in the region.         There was no immediate Chinese response to the flights conducted without prior notification as demanded under the new declaration from Beijing which asserted the right to identify monitor and possibly take military action against any aircraft that enter the area. The unexpected announcement by China was among its boldest moves yet in a struggle for power in Asia with the United States and by extension its regional allies including Japan. The United States long the dominant power in the region has been scrambling to shore up its influence there promising in what it called a pivot to Asia in 2011 to refocus its energies after the wars in Iraq and Afghanistan diverted its time and resources.         Having Japan in the mix only adds volatility. The country has its own tangled history with China which has sped past Japan as an economic power and which retains bitter memories of imperial Japans military invasion last century. Under its conservative leader Shinzo Abe Japan has refused to back down in the dispute with China over the uninhabited islands which Japan has long controlled.         For the White House the flare-up could prove a major distraction for Vice President Joseph R. Biden Jr. as he embarks on a weeklong tour of China Japan and South Korea. Administration officials are eager to focus on issues like North Korea and an American-led trans-Pacific trade deal meant to bolster economic ties in the region even as China woos its neighbors with aid and investment.         The islands called the Senkaku in Japan and the Diaoyu in China are currently administered by the Japanese who consider the airspace above the islands to be theirs. American officials have been increasingly worried about the standoff which they fear could lead to conflict. By treaty the United States is obligated to defend Japan if it is attacked.         But both China and Americas Asian allies know that Washingtons focus has been elsewhere a reality that became evident when President Obama had to cancel a trip to an Asian summit meeting during the recent American government shutdown.         Pressed on whether the Chinese move represents an overt attempt to fill an American security void in the region Pentagon officials responded by pointing to the American response to the catastrophic typhoon that struck the Philippines this month. The United States quickly moved in hundreds of Marines dozens of transport aircraft and an entire aircraft carrier strike group.  However Mr. Obama is fielding a new national security team with views on Asia that are still coalescing and with relatively little experience in the region.         In her first major speech on Asia policy last week Mr. Obamas national security adviser Susan E. Rice did not mention the mutual defense clause in the treaty between the United States and Japan  an omission her colleagues dismissed as irrelevant since American officials reiterate it religiously but which troubled some in Japan.         But Defense Secretary Chuck Hagel wasted no time in responding to the initial Chinese declaration issuing a statement on Saturday reiterating that the United States was steadfast in our commitments to our allies and partners. He also repeated that the mutual defense treaty with Japan applies to the disputed islands.         American officials said Tuesday that the United States military would continue to stage a standard cycle of training flights over the East China Sea. The flight by the bombers was first reported Tuesday by The Wall Street Journal.         The move by China on Saturday appeared to be another step in its efforts to intensify pressure on Japan over the contested islands. In the past year Chinese paramilitary ships have made almost daily incursions into the waters around the islands including waters claimed by Japan. The incursions have led to a constant game of cat-and-mouse on the high seas in which the Japanese Coast Guard pursues the Chinese ships with both sides using bullhorns and electronic sign boards to tell the other to stay out of its territorial waters.        
26,100000002547646,1,Article,News,World,world,asia,"With Glut of Lonely Men, China Has an Approved Outlet for Unrequited Lust",DAN LEVIN,,http://www.nytimes.com/2013/11/27/world/asia/with-glut-of-lonely-men-china-has-an-approved-outlet-for-unrequited-lust.html,8,GUANGZHOU China  Slack-jawed and perspiring Chen Weizhou gazed at a pair of life-size female dolls clad just barely in lingerie and lace stockings. Above these silicone vixens an instructional video graphically depicted just how realistic they felt once undressed.         A 46-year-old tour bus driver Mr. Chen had come earlier this month to the Guangzhou National Sex Culture Festival for fun which was not how he described intimacy with his wife who did not attend. When youre young sex is so mysterious but once youre married it gets really bland he said barely taking his eyes off the screen.         With an official theme of healthy sex happy families the 11th annual exposition sought to remedy the plight of Chinese men like Mr. Chen  and their wives if they are married.         The overwhelming presence of men at the festival mirrored a demographic imbalance in China where decades of the one-child rule and a cultural preference for sons combined with illegal sex-selective abortions have distorted the countrys gender ratio to 118 newborn boys for every 100 girls in 2012 rather than the normal 103 boys. In Guangdong Province home to a migrant worker population of 30 million  Chinas largest  the scarcity of women leaves bachelors with limited options.         Filling an exhibition center here in the capital of Guangdong in southern China the festival was a three-day mating ritual between capitalism and hedonism all diligently observed by that most prudish of chaperones: the Chinese government. Erotic possibilities abounded including a transgender fashion show sliced deer antler marketed as an aphrodisiac naughty nurse costumes and some flesh-color objects disconcertingly called Captain Stabbing.         Three decades after China began shedding its priggish Mao-era mores sex is now a big business here. Across the country pink-lit hair salons staffed by provocatively garbed women compete with massage parlors and late-night paid companions who slip their business cards under hotel room doors. Those looking to enhance their encounters can shop at countless adult health product stores and on the Internet.         Most of the inventory is made in China. According to state news media more than 1000 Chinese companies manufacture around 70 percent of the worlds sex toys generating $2 billion a year as of 2010.         The bounty of carnal titillation must contend with the firm hand of the Communist Party which bans pornography and punishes those guilty of group licentiousness in the name of protecting traditional Chinese values. But the partys moral authority has frayed of late because of the publicized antics of its friskier members. In June a government official was sentenced to 13 years in prison for corruption after a video surfaced showing him in bed with an 18-year-old woman. His fall came three months after photos depicting a coterie of six naked people including a party official and his wife exploded on the Internet.         In an attempt to give the sex festival a veneer of respectability government-run medical organizations sponsored booths in a side room which were unsurprisingly desolate. The main draw was lust.         Thousands of visitors nearly all middle-aged men wielding cameras poured through the aisles in search of any visible flesh. Guys have been taking my picture all day said a bikini-clad model Liang Lin 23 who was hugging her bare midriff defensively as a throng of men jostled desperately to get a better shot.         Not far away a male crowd waited for a diminutive Japanese pornography star named Rei Mizuna to appear. When she finally emerged from a dressing room to hand out racy autographed photos her frenzied fans surged forward with such zeal they shattered a glass display case.         Those unrequited desires have helped spawn a booming domestic sex toy industry. A stuffed man doesnt know what its like to be hungry explained a salesman at one booth filled with inflatable dolls. Just then an older gentleman approached and tried to bargain over an $8 figure with black tresses and a vacant stare.        
27,100000002591415,1,Article,News,World,world,europe,Protesters in Kiev Topple Lenin Statue as Rallies Grow,DAVID M. HERSZENHORN;ANDREW E. KRAMER,,http://www.nytimes.com/2013/12/09/world/europe/kiev-teems-with-pro-europe-protesters-as-thousands-more-gather.html,1,KIEV Ukraine  Public protests thundered into a full-throttle civil uprising in Ukraine on Sunday as hundreds of thousands of protesters answered President Viktor F. Yanukovichs dismissiveness with their biggest rally so far demanding that he and his government resign.         At the height of the unrest on Sunday night a seething crowd toppled and smashed a statue of Lenin the most prominent monument to the Communist leader in Kiev. The act was heavy with symbolism underscoring the protesters rage at Russia over its role in the events that first prompted the protests: Mr. Yanukovichs abrupt refusal to sign sweeping political and free-trade agreements with the European Union.         After an electrifying assembly in Independence Square in the center of Kiev the main focus of the protests the huge crowd surged across the capital erecting barriers to block the streets around the presidential headquarters and pitching huge tents in strategic intersections. They were not challenged by the police who have largely disengaged since their bloody crackdown on a group of protesters on Nov. 30 sharply increased outrage at the government.         International concern over the unrest in Ukraine appeared to deepen on Sunday as the United Nations secretary general Ban Ki-moon telephoned Mr. Yanukovich and Western leaders continued to call on him to respond to the demonstrators demands. The European Union has been eager to draw Ukraine a nation of 46 million into closer alliance with the West while Russia has sought to safeguard its major economic and political interests in its close neighbor. Making the crisis more acute Ukraine is teetering on the verge of bankruptcy and is desperate for financial assistance from abroad.         The spreading disorder set off a new round of speculation that Mr. Yanukovich would declare a state of emergency and potentially turn again to force by ordering the removal of demonstrators who have occupied Independence Square and several public buildings including Kievs City Hall. There were reports on Sunday that the security services were preparing to bring charges of treason against three opposition leaders in Parliament who have been at the forefront of the demonstrations.         One of those leaders Arseniy P. Yatsenyuk of the opposition Fatherland party called for mass civil disobedience if Mr. Yanukovich tried to impose martial law. In the case that a state of emergency is declared everyone should go to Maidan Mr. Yatsenyuk said referring to Independence Square.         Mr. Yanukovich only added to the demonstrators anger by stopping on his way back from China on Friday to meet with President Vladimir V. Putin of Russia in Sochi the Russian resort city. Rumors immediately began swirling that Mr. Yanukovich had cut a secret economic deal with Mr. Putin that would lead to Ukraine joining a customs union with Russia Belarus and Kazakhstan a step that many Ukrainians believe would deliver their countrys future into the Kremlins hands. Both governments denied the rumors but the protesters do not trust either Mr. Putin or Mr. Yanukovich and opposition leaders used the matter on Sunday to whip up the crowd in Kiev.         Today they fall on their knees in front of the president of Russia and surrender us to the customs union said Oleg Tyagnibok the leader of the nationalist Svoboda Party. We demand to make public what these secret negotiations were about. They bring us back to the time of Stalinism. Is this 1937?         Later as the Lenin statue was pulled down and men took turns splintering it to bits with a sledgehammer protesters twice sang the national anthem removing their caps and covering their hearts with their hands. One of the hammerers wore his hair in a mohawk; another was a priest in black vestments. Onlookers shielded their faces from the flying granite chips as they cheered them on yelling: Good job guys.         A spokesman for Prime Minister Mykola Azarov called the statues destruction barbaric.        
